{
  "status": "ok",
  "confidence": 0.85,
  "source_refs": [
    "ade-spese-sanitarie-aspetti-generali#detrazione-19-e-parte-eccedente",
    "ade-spese-sanitarie-aspetti-generali#pagamento-tracciabile",
    "ade-spese-sanitarie-aspetti-generali#eccezioni-contanti",
    "ade-spese-sanitarie-aspetti-generali#rateizzazione",
    "ade-spese-sanitarie-aspetti-generali#conservazione-documenti"
  ],
  "payload": {
    "misura_id": "detrazione-spese-sanitarie",
    "titolo_semplice": "Sconto sulle tasse per le spese mediche",
    "cosa_e": "Le spese sanitarie danno diritto a una detrazione dall'Irpef. Detrazione vuol dire sconto sulle tasse che paghi. L'Irpef è l'imposta che paghi sul tuo reddito. Lo sconto non si calcola su tutta la spesa dell'anno.",
    "quanto_vale": "Puoi portare in detrazione dall'Irpef il 19% delle spese sanitarie. Il 19% si calcola solo sulla parte eccedente l'importo di 129,11 euro. Quindi i primi 129,11 euro di spesa dell'anno restano fuori dal calcolo.",
    "a_chi_spetta": [
      "Devi pagare con versamento bancario o postale o altri sistemi tracciabili. La detrazione del 19% degli oneri indicati nell'articolo 15 del Tuir è fruibile soltanto a questa condizione.",
      "Il versamento in contanti resta ammesso per l'acquisto di medicinali e di dispositivi medici. Resta ammesso anche per tutte le prestazioni sanitarie rese dalle strutture pubbliche. Resta ammesso per le strutture private accreditate al Servizio sanitario nazionale. In questi casi non perdi il diritto alla detrazione.",
      "Devi conservare i giustificativi delle spese. Li conservi per tutto il tempo in cui l'Agenzia delle entrate può effettuare un accertamento. Cioè fino al 31 dicembre del quinto anno successivo."
    ],
    "attenzione": [
      "Puoi ripartire la detrazione in quattro quote annuali costanti e di pari importo. Puoi farlo quando il loro ammontare complessivo annuo è superiore a 15.493,71 euro.",
      "La fonte letta non indica una scadenza entro cui accedere a questa detrazione.",
      "La fonte letta non dice per quanti anni indietro puoi ancora recuperare questa detrazione."
    ],
    "glossario": [
      {
        "termine": "detrazione",
        "spiegazione_semplice": "detrazione: uno sconto sulle tasse che devi pagare."
      },
      {
        "termine": "Irpef",
        "spiegazione_semplice": "Irpef: l'imposta che paghi allo Stato sul tuo reddito."
      },
      {
        "termine": "parte eccedente",
        "spiegazione_semplice": "parte eccedente: la parte di spesa che supera una certa cifra."
      },
      {
        "termine": "sistemi tracciabili",
        "spiegazione_semplice": "sistemi tracciabili: pagamenti che lasciano una traccia scritta, come bancomat o carta."
      },
      {
        "termine": "giustificativi delle spese",
        "spiegazione_semplice": "giustificativi delle spese: le ricevute e le fatture che provano la spesa.",
        "tipo_documento_collegato": "altro"
      },
      {
        "termine": "accertamento",
        "spiegazione_semplice": "accertamento: il controllo con cui l'Agenzia delle entrate verifica la tua dichiarazione."
      },
      {
        "termine": "Tuir",
        "spiegazione_semplice": "Tuir: il Testo unico delle imposte sui redditi, la legge sulle imposte sul reddito."
      }
    ],
    "iterazione": 2,
    "disclaimer": "Queste informazioni servono solo a orientarti e non sono una consulenza. Verifica le scadenze su agenziaentrate.gov.it e per la tua situazione specifica rivolgiti a un CAF o a un commercialista.",
    "source_refs": [
      "ade-spese-sanitarie-aspetti-generali#detrazione-19-e-parte-eccedente",
      "ade-spese-sanitarie-aspetti-generali#pagamento-tracciabile",
      "ade-spese-sanitarie-aspetti-generali#eccezioni-contanti",
      "ade-spese-sanitarie-aspetti-generali#rateizzazione",
      "ade-spese-sanitarie-aspetti-generali#conservazione-documenti"
    ]
  }
}
